﻿<?xml version="1.0" encoding="UTF-8"?>
<!DOCTYPE cartelera SYSTEM "cine.dtd">
<cartelera>
    <pelicula codigo="p1" duracion="152" anyo="2002">
      <titulo>AQUELLAS JUERGAS UNIVERSITARIAS</titulo>
      <titulo_original>Old School</titulo_original>
      <nacionalidad>Estados Unidos</nacionalidad>
      <genero>Comedia</genero>
      <clasificacion edad="tp"/>
      <sinopsis>
        Mitch, Frank y Beanie son tres amigos treintañeros cuyas vidas
        no son exactamente lo que esperaban...
      </sinopsis>
      <director>Todd Philips</director>
      <reparto>
          <actor>Luke Wilson</actor>
          <actor>Will Farrel</actor>
          <actor>Vince Vaughn</actor>
      </reparto>
      <web>http://www.uip.es</web>
      <cartel>caratulas/Aquellas juergas.jpg</cartel>
    </pelicula>
    <pelicula codigo="p17" duracion="06">
      <titulo>EL ORO DE MOSCU</titulo>
      <nacionalidad> España</nacionalidad>
      <genero>Comedia</genero>
      <sin_clasificar/>
      <sinopsis>
        Por una extraña coincidencia del destino, alguien recibe una
      </sinopsis>
      <director>Jesús Bonilla</director>
      <reparto>
          <actor>Jesús Bonilla</actor>
          <actor>Santiago Segura</actor>
          <actor>Alfredo Landa</actor>
          <actor>Concha Velasco</actor>
          <actor>Antonio Resines</actor>
          <actor>Gabino Diego, Maria Barranco</actor>
          <actor>Maria Barranco</actor>
      </reparto>
    </pelicula>
</cartelera>